Name,Description,Energy,Rating
Meditation,Practice mindfulness and deep breathing techniques to relax your mind and body. Focus on the present moment to reduce stress and anxiety.,Low,
Reading,Curl up with a good book and immerse yourself in a captivating story. Reading can provide an escape from everyday worries and help you unwind.,Low,1
Nature Walk,Take a leisurely stroll in a nearby park or nature reserve. Enjoy the sights and sounds of nature which can have a calming and rejuvenating effect on your mood.,Low,
Gentle Yoga,Engage in a series of gentle yoga poses to stretch and release tension in your muscles. Focus on connecting your breath with movement to promote relaxation and ease.,Low,
Outdoor Adventure,Embark on an exciting outdoor adventure such as hiking rock climbing or kayaking. Get your adrenaline pumping while enjoying the beauty of nature.,High,
Dance Workout,Put on your favorite music and dance away your stress. A high-energy dance workout can elevate your mood and boost your endorphin levels.,High,
High-Intensity Interval Training (HIIT),Get your heart rate up with a HIIT workout that combines short bursts of intense exercise with brief rest periods. HIIT is an efficient way to burn calories and increase energy levels.,High,
Art Therapy,Express yourself through art by painting drawing or sculpting. Art therapy can help you process emotions and reduce symptoms of anxiety and depression.,Low,
Journaling,Take some time to journal your thoughts and feelings. Writing can be a therapeutic outlet for processing emotions and gaining insight into your mental state.,Low,
Pet Therapy,Spend quality time with a furry friend by cuddling playing or going for a walk together. Pets can provide comfort and companionship to help alleviate feelings of loneliness and sadness.,High,
Volunteer Work,Give back to your community by volunteering for a cause you're passionate about. Helping others can give you a sense of purpose and fulfillment.,High,
Movie Marathon,Pick a few of your favorite movies or TV shows make some popcorn and have a cozy movie marathon in the comfort of your own home.,Low,
Puzzles and Games,Spend some time working on puzzles like crosswords Sudoku or jigsaw puzzles. Alternatively you can play board games or card games with family or friends for some relaxed entertainment.,Low,
DIY Crafts,Get creative with simple do-it-yourself crafts like painting knitting or making handmade greeting cards. Engaging in arts and crafts can be both calming and fulfilling.,Low,
Baking or Cooking,Experiment in the kitchen by trying out new recipes or baking your favorite treats. Cooking can be a therapeutic activity that allows you to focus on creating something delicious.,High,1
Refresh Your Space,Take some time to rejuvenate your living environment by giving it a refresh. Start by decluttering and organizing your belongings to create a clean and tidy space. Consider rearranging furniture or adding some decorative touches to breathe new life into your home.,High,
